{
  "schema": "distributed_world_simulator.work_order.v1",
  "work_order_id": "V0-P7-EG1-FIXTURE-REPAIR-R1",
  "project_epoch": "E2026-09-07-V0-P7-EG1-FIXTURE-REPAIR-R1",
  "program": "V0",
  "goal_checkpoint": "V0_P7_BOUNDED_TERRAIN_MUTATION",
  "state": "PLANNED",
  "work_order_type": "FIX",
  "base_sha": "c14c37cce4930a8b5132d5d5fdfab3a5dfa82f5f",
  "branch": "repair/v0-p7-eg1-loss-tolerant-fixture-r1",
  "scope": "Repair the EG1 three-process TEST FIXTURE one-shot unreliable delivery assumption. No production network/runtime mutation, no acceptance or MVP dispatch. Existing original 33 domain/identity/ledger assertions remain unchanged.",
  "allowed_paths": ["tools/network/eg1_client_worker.gd", "tools/network/eg1_sim_server_worker.gd", "tools/network/eg1_gateway_worker.gd", "tools/network/eg1_fixture_repeat_port.gd", "tests/network/test_eg1_gateway_processes.gd", "tests/network/fixtures/eg1_fixture_repeat_checks.gd", "docs/control/p7-eg1-fixture-repair-r1/**", ".github/workflows/p7-eg1-fixture-repair.yml"],
  "forbidden_paths": ["scripts/network/**", "runtime/**", "scenes/**", "scripts/runtime/**", "config/control/harness/executions/**", "config/control/harness/acceptance/**", "RUN_WORLD_REGRESSION_TESTS.ps1"],
  "required_predicates": ["SINGLE_INPUT_LOSS_COUNTERFACTUAL_REPRODUCED", "BOUNDED_REPEAT_COPY_IDENTITY_AND_ERROR_PROPAGATION", "ORIGINAL_EG1_ASSERTIONS_PRESERVED", "FIRST_INPUT_AND_SNAPSHOT_LOSS_PASS", "PERMANENT_LOSS_FAILS_CLOSED", "FULL_WORLD_CORE_REGRESSION_PASS", "EXACT_CONTROL_CHECKS", "FRESH_INDEPENDENT_REVIEW", "FRESH_INDEPENDENT_VERIFICATION"],
  "required_outputs": ["Minimal test-only patch and deterministic negative/positive evidence", "Exact CI logs and all child reports", "Separate independent role results and human merge request"],
  "stop_conditions": ["HUMAN_MERGE_GATE", "CONFIRMED_PRODUCTION_OWNER_CHANGE_REQUIRED", "PROVEN_EXTERNAL_AUTHORIZATION_BLOCKER"],
  "risk_class": "HIGH",
  "review_required": true,
  "evidence_map_required": true,
  "required_review_roles": ["IMPLEMENTER", "REVIEWER", "VERIFIER", "DIRECTOR"],
  "issued_at_utc": "2026-09-07T08:30:00Z",
  "human_approval_required_for": ["MERGE", "CANONICAL_CHECKPOINT_ACCEPTANCE"],
  "notes": "Bounded test-only repair continuation under the existing closure mission, not a production execution activation or mutation lease. Main runtime authority remains false. This record remains immutable; execution facts are appended separately.",
  "design_brief": {
    "problem_statement": "EG1 sends one INPUT and one SNAPSHOT over UNRELIABLE_SEQUENCED, then requires all four logical results without recovery. Dropping exactly the first INPUT reproduces the observed three-operation timeout.",
    "current_behavior": "Native CI can lose the single movement/snapshot datagram, making the composition fixture fail nondeterministically despite valid transport behavior.",
    "desired_behavior": "Test workers send a fixed finite set of identical physical copies for unreliable fixture frames; existing canonical receive-boundary deduplication still admits each logical operation only once. Persistent loss and real send errors still fail.",
    "alternatives_considered": ["Switch INPUT/SNAPSHOT to reliable transport: rejected, changes exercised protocol", "Retry the whole suite until green: rejected", "New domain replay owner: rejected", "Fixed bounded physical redundancy inside test fixtures only"],
    "selected_design": "A test-only ENet port subclass repeats identical validated unreliable wire frames a fixed number of times at fixed intervals, with bounded queue and explicit errors. Production port, boundary, gateway and domain service are unchanged. Add deterministic receive-loss injection only for verification cases.",
    "why_selected": "Preserves real ENet, physical channels/modes, all original canonical equivalence/unique operation assertions, and existing dedup owner without pretending unreliable transport guarantees delivery.",
    "affected_owners": ["EG1 validation fixtures", "V0 closure evidence"],
    "dependencies": ["Existing canonical UNRELIABLE_SEQUENCED receive-boundary duplicate suppression", "Exact approved double Godot"],
    "non_goals": ["Production retransmission protocol", "New scheduler or authority", "Canonical P7 acceptance without human decision", "MVP runtime"],
    "expected_risks": ["Copies must not cross sessions or mask genuine send errors", "All-loss path must remain bounded failure", "Fixture redundancy is not proof of general product loss recovery"],
    "validation_plan": ["Finite-copy and cleanup unit checks", "Original EG1 scenario", "First INPUT/SNAPSHOT loss per hop with original domain assertions", "Permanent INPUT/SNAPSHOT loss expected failure", "Full unchanged world/core runner", "Fresh exact independent review and verification"]
  }
}
