{
  "schema": "distributed_world_simulator.work_order.v1",
  "work_order_id": "H0-0-WO-002",
  "project_epoch": "E2026-08-11-H0-0-R1",
  "program": "HARNESS",
  "goal_checkpoint": "H0_0_SCAFFOLD_READY",
  "state": "DISPATCHED",
  "work_order_type": "CONTROL",
  "base_sha": "790fd79f8055fefa19cf9d7263441fc9f4326ebd",
  "branch": "control/h0-closed-loop-development",
  "scope": "Repair post-proposal recovery so acceptance tests are phase-independent and historical Evidence Maps and Review Results remain validated but isolated from the active Work Order.",
  "allowed_paths": [
    "scripts/harness/state_builder.py",
    "tests/harness/**",
    "config/control/harness/executions/E2026-08-11-H0-0-R1/**",
    "docs/checkpoints/2026-08-11_H0_0_RESTART_SAFE_HARNESS_SCAFFOLD_RU.md"
  ],
  "forbidden_paths": [
    "project.godot",
    "CONTROL_DEVELOPMENT.ps1",
    "scenes/**",
    "scripts/construction/**",
    "scripts/network/**",
    "scripts/runtime/**",
    "validation/harness/**",
    "config/control/harness/checkpoint-catalog.v1.json",
    "config/control/harness/event.schema.v1.json",
    "config/control/harness/evidence-map.schema.v1.json",
    "config/control/harness/harness-policy.v1.json",
    "config/control/harness/human-attention.schema.v1.json",
    "config/control/harness/project-epoch.schema.v1.json",
    "config/control/harness/project-goals.v1.json",
    "config/control/harness/repair-doctrine.v1.json",
    "config/control/harness/review-policy.v1.json",
    "config/control/harness/risk-policy.v1.json",
    "config/control/harness/scheduler-policy.v1.json",
    "config/control/harness/work-order.schema.v1.json"
  ],
  "required_predicates": [
    "CONTROL_DEVELOPMENT_STATUS_WORKS",
    "CONTROL_DEVELOPMENT_PLAN_WORKS",
    "CONTROL_DEVELOPMENT_RESUME_WORKS",
    "CANONICAL_CONTRACTS_LOAD_PASS",
    "REVIEW_AND_EVIDENCE_CONTRACTS_LOAD_PASS",
    "WORK_ORDER_SCHEMA_VALIDATION_PASS",
    "EVENT_REDUCER_REBUILDS_STATE_PASS",
    "PROJECT_EPOCH_VALIDATION_PASS",
    "MAIN_MOVEMENT_EPOCH_INVALIDATION_DETECTION_PASS",
    "DRY_RUN_C22_PLAN_PASS",
    "RECOVERY_FIXTURE_WITHOUT_CHAT_PASS",
    "NO_RUNTIME_SCOPE_CHANGES",
    "PC0_NON_RED"
  ],
  "required_outputs": [
    "Phase-independent review/evidence acceptance tests",
    "Active Work Order Evidence Map and Review Result isolation",
    "Fresh exact-head Reviewer and Verifier PASS",
    "Fresh Evidence Map and post-build critique",
    "Replacement checkpoint proposal without rewriting H0-0-WO-001"
  ],
  "stop_conditions": [
    "Any runtime or canonical contract path would need to change",
    "Historical H0-0-WO-001 events would need mutation",
    "PC0 becomes RED",
    "A blocking Human Attention decision is required"
  ],
  "risk_class": "HIGH",
  "risk_reasons": [
    "The repair changes which Evidence Maps and Review Results may authorize an active checkpoint.",
    "Incorrect multi-Work-Order isolation could use stale historical PASS evidence.",
    "The public recovery contract must remain valid after a terminal proposal and a follow-up Work Order."
  ],
  "review_required": true,
  "required_review_roles": ["IMPLEMENTER", "REVIEWER", "VERIFIER", "DIRECTOR"],
  "design_brief": {
    "problem_statement": "After H0-0-WO-001 reached CHECKPOINT_PROPOSED, a live acceptance test remained hardcoded to the preceding STALE review phase; opening a recovery Work Order also exposes global Evidence Map and Review Result identity checks across historical Work Orders.",
    "current_behavior": "The suite passes only before fresh review/evidence is recorded, and a second Work Order rejects valid historical Evidence Maps first and historical Review Results next as identity mismatches against the new active Work Order.",
    "desired_behavior": "Acceptance tests derive freshness expectations from independent Git/document facts. State reconstruction structurally validates every claimed Evidence Map and Review Result, then partitions each collection by work_order_id so only active documents enter active output, freshness and checkpoint authorization.",
    "alternatives_considered": [
      "Rewrite terminal H0-0-WO-001 history.",
      "Delete or relocate historical Evidence Maps.",
      "Create H0-0-WO-002 and implement active Work Order map/review isolation with phase-independent tests."
    ],
    "selected_design": "Preserve all H0-0-WO-001 commits/events, create a new bounded Work Order, validate every claimed Evidence Map and Review Result before filtering, partition each validated collection by active work_order_id, expose only active documents in review.evidence_maps and review.reviews, and make tests branch-phase independent.",
    "why_selected": "This keeps events immutable, retains historical documents durably and validates them globally, excludes them from active output/authorization, prevents cross-Work-Order PASS reuse, and makes clean-checkout recovery valid at every checkpoint phase.",
    "affected_owners": ["MAIN/HARNESS", "PC0"],
    "dependencies": ["H0-0-WO-001 terminal ledger", "canonical Evidence Map schema", "state_builder Git-only reconstruction", "tests/harness acceptance suite"],
    "non_goals": ["No runtime development", "No canonical schema change", "No scheduler implementation", "No H0-0-WO-001 rewrite", "No C22 branch creation"],
    "expected_risks": ["Fail-open filtering before type-specific validation", "Historical map or review authorizing the active Work Order", "Empty active evidence/review sets hidden by prior documents", "Malformed historical claims skipped by filtering", "Tests coupled to a particular ledger phase"],
    "validation_plan": [
      "Validate every document claiming the canonical Evidence Map or Review Result identity before filtering.",
      "Prove historical maps and reviews remain durable and globally validated but are absent from active review.evidence_maps/review.reviews.",
      "Prove valid historical PASS maps/reviews do not break reconstruction and cannot authorize the active Work Order.",
      "Prove malformed claimed historical maps/reviews fail closed before partitioning.",
      "Prove an active Work Order without its own map/review returns Status, Plan and Resume exit zero with explicit checkpoint blockers.",
      "Prove wrong checkpoint/risk identity on the active Work Order map fails closed.",
      "Prove fresh active map/review alone controls freshness and checkpoint authorization.",
      "Prove H0-0-WO-001 still reduces to CHECKPOINT_PROPOSED while H0-0-WO-002 is active and emits any replacement proposal through its own ledger.",
      "Run phase-independent tests both before and after fresh active review/evidence records are appended, deriving expectations from independent Git/document facts.",
      "Run root/non-root Status, Plan and Resume from a clean canonical URL clone.",
      "Verify C22 remains blocked, runtime remains unauthorized and PC0 remains non-RED."
    ]
  },
  "repair_context_required": false,
  "evidence_map_required": true,
  "human_attention_triggers": ["CANONICAL_CONTRACT_CHANGE_REQUIRED", "RISK_RECLASSIFIED_CRITICAL", "CONTROL_DOCS_MERGE_APPROVAL"],
  "issued_at_utc": "2026-08-11T06:45:29Z",
  "human_approval_required_for": ["CONTROL_DOCS_ONLY_MERGE"],
  "notes": "This Work Order supersedes only the unaccepted checkpoint proposal for delivery purposes; H0-0-WO-001 remains immutable historical evidence."
}
